{
  "$schema": "../../health/schemas/capability-manifest.v1.schema.json",
  "schemaVersion": 1,
  "ownerScope": { "kind": "Game", "gameId": "grandtheftautov" },
  "supportingFiles": [
    "scripts/games/grandtheftautov/health/adapter.psd1",
    "scripts/games/grandtheftautov/health/Grid.Health.GtaV.psm1",
    "scripts/games/grandtheftautov/health/collectors/Test-GridGtaConnectedContext.ps1",
    "scripts/games/grandtheftautov/health/collectors/Get-GridGtaInstallationInventory.ps1",
    "scripts/games/grandtheftautov/health/collectors/Get-GridGtaInstallationSet.ps1",
    "scripts/games/grandtheftautov/health/collectors/Resolve-GridGtaSetupReadiness.ps1",
    "scripts/games/grandtheftautov/health/collectors/Resolve-GridGtaRequestContext.ps1",
    "scripts/games/grandtheftautov/health/collectors/Get-GridGtaCrashInvestigationEvidence.ps1",
    "scripts/games/grandtheftautov/health/collectors/Resolve-GridGtaCrashAssessment.ps1",
    "scripts/games/grandtheftautov/health/schemas/gta-crash-evidence.v1.schema.json",
    "scripts/games/grandtheftautov/Invoke-GridGtaSetupReadiness.ps1",
    "scripts/games/grandtheftautov/setup/New-GridGtaDeploymentPlan.ps1",
    "scripts/games/grandtheftautov/setup/Invoke-GridAuthorizedGtaDeployment.ps1",
    "scripts/games/grandtheftautov/setup/recipes/forever-together.v1.json",
    "scripts/games/grandtheftautov/discovery.steam.v1.json",
    "scripts/games/grandtheftautov/tests/GtaDeployment.Tests.ps1",
    "scripts/games/grandtheftautov/tests/GtaSetupReadiness.Tests.ps1",
    "scripts/games/grandtheftautov/tests/GtaCrashInvestigation.Tests.ps1"
  ],
  "capabilities": [
    {
      "capabilityId": "grid.game.grandtheftautov.context.probe",
      "capabilityVersion": "1.0.0",
      "ownerScope": { "kind": "Game", "gameId": "grandtheftautov" },
      "implementation": { "files": ["scripts/games/grandtheftautov/health/collectors/Test-GridGtaConnectedContext.ps1"], "entryPoint": "Test-GridGtaConnectedContext" },
      "inputSchema": { "type": "object", "required": ["gameRoot"] },
      "outputSchema": { "type": "boolean" },
      "preconditions": ["The caller supplies an explicit candidate installation root."],
      "dependencies": [],
      "sideEffectClassification": "ExternalRead",
      "requiredAuthority": { "kind": "AuthorizedExternalRead", "description": "Checks only the explicit directory and known executable names." },
      "rollback": { "mode": "NotRequired", "description": "Read-only probe." },
      "terminalStates": ["Connected", "NotConnected"]
    },
    {
      "capabilityId": "grid.game.grandtheftautov.installation.inventory",
      "capabilityVersion": "1.0.0",
      "ownerScope": { "kind": "Game", "gameId": "grandtheftautov" },
      "implementation": { "files": ["scripts/games/grandtheftautov/health/collectors/Get-GridGtaInstallationInventory.ps1"], "entryPoint": "Get-GridGtaInstallationInventory" },
      "inputSchema": { "type": "object", "required": ["gameRoot"] },
      "outputSchema": { "type": "object", "required": ["schemaVersion", "gameId", "rootPath", "edition", "components"] },
      "preconditions": ["The exact installation root was explicitly selected or previously connected."],
      "dependencies": ["grid.game.grandtheftautov.context.probe"],
      "sideEffectClassification": "ExternalRead",
      "requiredAuthority": { "kind": "AuthorizedExternalRead", "description": "Reads bounded known root and scripts-folder entries without opening game archives or saves." },
      "rollback": { "mode": "NotRequired", "description": "Read-only inventory." },
      "terminalStates": ["Collected", "Failed"]
    },
    {
      "capabilityId": "grid.game.grandtheftautov.installation-set.inventory",
      "capabilityVersion": "1.0.0",
      "ownerScope": { "kind": "Game", "gameId": "grandtheftautov" },
      "implementation": { "files": ["scripts/games/grandtheftautov/health/collectors/Get-GridGtaInstallationSet.ps1"], "entryPoint": "Get-GridGtaInstallationSet" },
      "inputSchema": { "type": "object", "required": ["candidateRoots"] },
      "outputSchema": { "type": "object", "required": ["schemaVersion", "status", "installations", "selectedInstallationId", "changedExternalState"] },
      "preconditions": ["Candidate roots are explicit structured inputs or deterministically discovered authorized paths."],
      "dependencies": ["grid.game.grandtheftautov.installation.inventory"],
      "sideEffectClassification": "ExternalRead",
      "requiredAuthority": { "kind": "AuthorizedExternalRead", "description": "Inventories each exact candidate independently and requires explicit selection when more than one is valid." },
      "rollback": { "mode": "NotRequired", "description": "Read-only installation-set inventory." },
      "terminalStates": ["Ready", "NeedsSelection", "NoInstallations", "SelectionNotFound"]
    },
    {
      "capabilityId": "grid.game.grandtheftautov.setup-readiness.resolve",
      "capabilityVersion": "1.0.0",
      "ownerScope": { "kind": "Game", "gameId": "grandtheftautov" },
      "implementation": { "files": ["scripts/games/grandtheftautov/health/collectors/Resolve-GridGtaSetupReadiness.ps1"], "entryPoint": "Resolve-GridGtaSetupReadiness" },
      "inputSchema": { "type": "object", "required": ["inventory", "target"] },
      "outputSchema": { "type": "object", "required": ["schemaVersion", "installationId", "status", "checks", "changedExternalState"] },
      "preconditions": ["Inventory comes from the bounded GTA installation collector; in-game and BattlEye facts require explicit operator confirmation."],
      "dependencies": ["grid.game.grandtheftautov.installation-set.inventory"],
      "sideEffectClassification": "None",
      "requiredAuthority": { "kind": "None", "description": "Reduces supplied observations into deterministic setup guidance." },
      "rollback": { "mode": "NotRequired", "description": "Pure readiness assessment." },
      "terminalStates": ["Ready", "Incomplete", "Blocked"]
    },
    {
      "capabilityId": "grid.game.grandtheftautov.request-context.resolve",
      "capabilityVersion": "1.0.0",
      "ownerScope": { "kind": "Game", "gameId": "grandtheftautov" },
      "implementation": { "files": ["scripts/games/grandtheftautov/health/collectors/Resolve-GridGtaRequestContext.ps1"], "entryPoint": "Resolve-GridGtaRequestContext" },
      "inputSchema": { "type": "object", "required": ["connectedRegistration"] },
      "outputSchema": { "type": "object", "required": ["status", "gameId", "installationId", "profileId", "edition", "contextFingerprint", "authorizedReadPaths", "exactReadResources"] },
      "preconditions": ["The shared authenticated request engine supplies the exact account-scoped connected registration; this resolver never searches an account store."],
      "dependencies": [],
      "sideEffectClassification": "None",
      "requiredAuthority": { "kind": "None", "description": "Validates structured account-owned identities and deterministically resolves the exact read scope without accessing external state." },
      "rollback": { "mode": "NotRequired", "description": "Pure identity and scope resolution." },
      "terminalStates": ["Resolved", "Failed"]
    },
    {
      "capabilityId": "grid.game.grandtheftautov.crash-evidence.collect",
      "capabilityVersion": "1.0.0",
      "ownerScope": { "kind": "Game", "gameId": "grandtheftautov" },
      "implementation": { "files": ["scripts/games/grandtheftautov/health/collectors/Get-GridGtaCrashInvestigationEvidence.ps1"], "entryPoint": "Get-GridGtaCrashInvestigationEvidence" },
      "inputSchema": { "type": "object", "required": ["context"] },
      "outputSchema": { "type": "object", "required": ["schemaVersion", "gameId", "installationId", "profileId", "contextFingerprint", "status", "evidence", "changedExternalState"] },
      "preconditions": ["The context is an exact account-owned registration resolved by the GTA adapter.", "The shared request engine consumed an exact read grant covering every filesystem and logical resource."],
      "dependencies": ["grid.game.grandtheftautov.request-context.resolve"],
      "sideEffectClassification": "ExternalRead",
      "requiredAuthority": { "kind": "AuthorizedExternalRead", "description": "Reads only declared edition-qualified roots and shared bounded Windows failure sources; it never launches or controls the game." },
      "rollback": { "mode": "NotRequired", "description": "Read-only evidence collection." },
      "terminalStates": ["Collected", "Partial", "Unavailable"]
    },
    {
      "capabilityId": "grid.game.grandtheftautov.crash-investigation.assess",
      "capabilityVersion": "1.0.0",
      "ownerScope": { "kind": "Game", "gameId": "grandtheftautov" },
      "implementation": { "files": ["scripts/games/grandtheftautov/health/collectors/Resolve-GridGtaCrashAssessment.ps1"], "entryPoint": "Resolve-GridGtaCrashAssessment" },
      "inputSchema": { "type": "object", "required": ["evidencePackage", "caseId"] },
      "outputSchema": { "type": "object", "required": ["schemaVersion", "caseId", "state", "assertions", "nextObservation", "diagnosticResult", "changedExternalState"] },
      "preconditions": ["Every diagnostic observation is provenance-bearing and bound to the same current context fingerprint."],
      "dependencies": ["grid.game.grandtheftautov.crash-evidence.collect"],
      "sideEffectClassification": "None",
      "requiredAuthority": { "kind": "None", "description": "Pure deterministic reduction; component presence alone cannot resolve cause." },
      "rollback": { "mode": "NotRequired", "description": "Pure assessment." },
      "terminalStates": ["InsufficientEvidence", "SupportedHypothesis", "ProvenCause"]
    },
    {
      "capabilityId": "grid.game.grandtheftautov.crash-investigation.collect",
      "capabilityVersion": "1.0.0",
      "ownerScope": { "kind": "Game", "gameId": "grandtheftautov" },